3gpp/3GPP_Rel19/processed/TS_36.104_36104-j20/tables/table_0279.csv

Number of TX antennas,Number of RX antennas,Propagation conditions andcorrelation matrix (Annex B),Frequency offset,SNR [dB],,,,
,,,,Burst format 0,Burst format 1,Burst format 2,Burst format 3,Burst format 4
1,2,AWGN,0,-14.2,-14.2,-16.4,-16.5,-7.2
,,ETU 70 Low*,270 Hz,-8.0,-7.8,-10.0,-10.1,-0.1
,4,AWGN,0,-16.9,-16.7,-19.0,-18.8,-9.8
,,ETU 70 Low*,270 Hz,-12.1,-11.7,-14.1,-13.9,-5.1
,8,AWGN,0,-19.8,-19.4,-21.5,-21.3,-11.8
,,ETU 70 Low*,270 Hz,-16.3,-15.9,-17.8,-17.5,-8.6
Note*:Not applicable for Local Area BS and Home BS.,,,,,,,,

3gpp/3GPP_Rel19/processed/TS_36.213_36213-j30_cover/full.md

10.1 UE procedure for determining physical uplink control channel assignment 398

16.4 Narrowband physical downlink shared channel related procedures 536

16.5 Narrowband physical uplink shared channel related procedures 549

16.7 Assumptions independent of physical channel related to narrowband IoT 564

16.9 UE procedure for receiving narrowband wake up signal 565